{
  "$schema": "../../schemas/figma-color-foundation-mutation.schema.json",
  "schemaVersion": "1.0.0",
  "id": "IOS-003.1-FIGMA-COLOR-MUTATION",
  "milestone": "IOS-003.1",
  "status": "implemented-pending-human-review",
  "mutationTimestamp": "2026-08-05T08:35:16Z",
  "operator": {
    "name": "Codex",
    "mechanism": "Figma Plugin API integration",
    "authenticated": true
  },
  "sourceRevision": {
    "gitCommit": "f3c4f0edff4a935deb9f3411ce074698b96c6169",
    "worktreeState": "dirty-uncommitted"
  },
  "file": {
    "key": "OJqxFKoGjRh4rrSZCKdkzi",
    "name": "InterfaceOS — Design System"
  },
  "page": {
    "id": "2:4",
    "name": "03 Foundations"
  },
  "section": {
    "id": "26:14",
    "name": "Color",
    "width": 1600,
    "height": 29588
  },
  "boards": [
    {
      "order": 1,
      "id": "2:16",
      "name": "Color / 01 Philosophy",
      "width": 1440,
      "height": 924,
      "y": 80,
      "header": {
        "id": "28:14",
        "name": "01.00 / Header"
      },
      "documentation": {
        "id": "28:19",
        "name": "01.00 / Documentation"
      },
      "content": {
        "id": "28:22",
        "name": "01.01 / Content"
      }
    },
    {
      "order": 2,
      "id": "26:15",
      "name": "Color / 02 Architecture",
      "width": 1440,
      "height": 922,
      "y": 1244,
      "header": {
        "id": "28:24",
        "name": "02.00 / Header"
      },
      "documentation": {
        "id": "28:29",
        "name": "02.00 / Documentation"
      },
      "content": {
        "id": "28:32",
        "name": "02.01 / Content"
      }
    },
    {
      "order": 3,
      "id": "26:16",
      "name": "Color / 03 Primitive Families",
      "width": 1440,
      "height": 4584,
      "y": 2406,
      "header": {
        "id": "28:34",
        "name": "03.00 / Header"
      },
      "documentation": {
        "id": "28:39",
        "name": "03.00 / Documentation"
      },
      "content": {
        "id": "28:42",
        "name": "03.01 / Content"
      }
    },
    {
      "order": 4,
      "id": "26:17",
      "name": "Color / 04 Semantic Colors",
      "width": 1440,
      "height": 2262,
      "y": 7230,
      "header": {
        "id": "28:44",
        "name": "04.00 / Header"
      },
      "documentation": {
        "id": "28:49",
        "name": "04.00 / Documentation"
      },
      "content": {
        "id": "28:52",
        "name": "04.01 / Content"
      }
    },
    {
      "order": 5,
      "id": "26:18",
      "name": "Color / 05 Theme Mapping",
      "width": 1440,
      "height": 1096,
      "y": 9732,
      "header": {
        "id": "29:14",
        "name": "05.00 / Header"
      },
      "documentation": {
        "id": "29:19",
        "name": "05.00 / Documentation"
      },
      "content": {
        "id": "29:22",
        "name": "05.01 / Content"
      }
    },
    {
      "order": 6,
      "id": "26:19",
      "name": "Color / 06 Text Hierarchy",
      "width": 1440,
      "height": 1106,
      "y": 11068,
      "header": {
        "id": "29:24",
        "name": "06.00 / Header"
      },
      "documentation": {
        "id": "29:29",
        "name": "06.00 / Documentation"
      },
      "content": {
        "id": "29:32",
        "name": "06.01 / Content"
      }
    },
    {
      "order": 7,
      "id": "26:20",
      "name": "Color / 07 Surface System",
      "width": 1440,
      "height": 1196,
      "y": 12414,
      "header": {
        "id": "29:34",
        "name": "07.00 / Header"
      },
      "documentation": {
        "id": "29:39",
        "name": "07.00 / Documentation"
      },
      "content": {
        "id": "29:42",
        "name": "07.01 / Content"
      }
    },
    {
      "order": 8,
      "id": "26:21",
      "name": "Color / 08 Border System",
      "width": 1440,
      "height": 1196,
      "y": 13850,
      "header": {
        "id": "29:44",
        "name": "08.00 / Header"
      },
      "documentation": {
        "id": "29:49",
        "name": "08.00 / Documentation"
      },
      "content": {
        "id": "29:52",
        "name": "08.01 / Content"
      }
    },
    {
      "order": 9,
      "id": "26:22",
      "name": "Color / 09 Alpha System",
      "width": 1440,
      "height": 982,
      "y": 15286,
      "header": {
        "id": "30:14",
        "name": "09.00 / Header"
      },
      "documentation": {
        "id": "30:19",
        "name": "09.00 / Documentation"
      },
      "content": {
        "id": "30:22",
        "name": "09.01 / Content"
      }
    },
    {
      "order": 10,
      "id": "27:14",
      "name": "Color / 10 Interactive States",
      "width": 1440,
      "height": 1196,
      "y": 16508,
      "header": {
        "id": "30:24",
        "name": "10.00 / Header"
      },
      "documentation": {
        "id": "30:29",
        "name": "10.00 / Documentation"
      },
      "content": {
        "id": "30:32",
        "name": "10.01 / Content"
      }
    },
    {
      "order": 11,
      "id": "27:15",
      "name": "Color / 11 Feedback States",
      "width": 1440,
      "height": 1152,
      "y": 17944,
      "header": {
        "id": "30:34",
        "name": "11.00 / Header"
      },
      "documentation": {
        "id": "30:39",
        "name": "11.00 / Documentation"
      },
      "content": {
        "id": "30:42",
        "name": "11.01 / Content"
      }
    },
    {
      "order": 12,
      "id": "27:16",
      "name": "Color / 12 Accessibility",
      "width": 1440,
      "height": 1490,
      "y": 19336,
      "header": {
        "id": "30:44",
        "name": "12.00 / Header"
      },
      "documentation": {
        "id": "30:49",
        "name": "12.00 / Documentation"
      },
      "content": {
        "id": "30:52",
        "name": "12.01 / Content"
      }
    },
    {
      "order": 13,
      "id": "27:17",
      "name": "Color / 13 Dashboard Colors",
      "width": 1440,
      "height": 1022,
      "y": 21066,
      "header": {
        "id": "32:14",
        "name": "13.00 / Header"
      },
      "documentation": {
        "id": "32:19",
        "name": "13.00 / Documentation"
      },
      "content": {
        "id": "32:22",
        "name": "13.01 / Content"
      }
    },
    {
      "order": 14,
      "id": "27:18",
      "name": "Color / 14 Chart Colors",
      "width": 1440,
      "height": 1022,
      "y": 22328,
      "header": {
        "id": "32:24",
        "name": "14.00 / Header"
      },
      "documentation": {
        "id": "32:29",
        "name": "14.00 / Documentation"
      },
      "content": {
        "id": "32:32",
        "name": "14.01 / Content"
      }
    },
    {
      "order": 15,
      "id": "27:19",
      "name": "Color / 15 Light Theme",
      "width": 1440,
      "height": 1458,
      "y": 23590,
      "header": {
        "id": "32:34",
        "name": "15.00 / Header"
      },
      "documentation": {
        "id": "32:39",
        "name": "15.00 / Documentation"
      },
      "content": {
        "id": "32:42",
        "name": "15.01 / Content"
      }
    },
    {
      "order": 16,
      "id": "27:20",
      "name": "Color / 16 Dark Theme",
      "width": 1440,
      "height": 1458,
      "y": 25288,
      "header": {
        "id": "32:44",
        "name": "16.00 / Header"
      },
      "documentation": {
        "id": "32:49",
        "name": "16.00 / Documentation"
      },
      "content": {
        "id": "32:52",
        "name": "16.01 / Content"
      }
    },
    {
      "order": 17,
      "id": "27:21",
      "name": "Color / 17 Decision Log",
      "width": 1440,
      "height": 1244,
      "y": 26986,
      "header": {
        "id": "33:14",
        "name": "17.00 / Header"
      },
      "documentation": {
        "id": "33:19",
        "name": "17.00 / Documentation"
      },
      "content": {
        "id": "33:22",
        "name": "17.01 / Content"
      }
    },
    {
      "order": 18,
      "id": "27:22",
      "name": "Color / 18 Review & Approval",
      "width": 1440,
      "height": 1038,
      "y": 28470,
      "header": {
        "id": "33:24",
        "name": "18.00 / Header"
      },
      "documentation": {
        "id": "33:29",
        "name": "18.00 / Documentation"
      },
      "content": {
        "id": "33:32",
        "name": "18.01 / Content"
      }
    }
  ],
  "collections": {
    "created": [
      "VariableCollectionId:63:14",
      "VariableCollectionId:63:15",
      "VariableCollectionId:63:16",
      "VariableCollectionId:63:17",
      "VariableCollectionId:63:18"
    ],
    "modesCreated": ["63:0", "63:1", "63:2", "63:3", "63:4", "63:5"],
    "localCollectionCount": 5,
    "localVariableCount": 80,
    "capturePath": "evidence/figma/ios-003-1-color-variables.capture.json"
  },
  "figmaRevision": {
    "status": "unavailable",
    "value": null,
    "reason": "The authenticated host runtime does not support saveVersionHistoryAsync; no revision ID was invented."
  },
  "screenshots": [
    {
      "nodeId": "26:16",
      "path": "evidence/screenshots/ios-003-1/primitive-families.png",
      "sha256": "cf5bc15fdbe6547dfab6cd6e32ba2f1366632458add98c29c7b00d671b317f4d"
    },
    {
      "nodeId": "26:17",
      "path": "evidence/screenshots/ios-003-1/semantic-colors.png",
      "sha256": "10eaae6d328b585f62289297d5f7195cdcf76259dd2907255fa5be93d154fd63"
    },
    {
      "nodeId": "26:18",
      "path": "evidence/screenshots/ios-003-1/theme-mapping.png",
      "sha256": "38df2288b95198f226ae3f1bee9a9ad06c1b48606c12068b3156563c015f20ac"
    },
    {
      "nodeId": "26:19",
      "path": "evidence/screenshots/ios-003-1/text-hierarchy.png",
      "sha256": "d914d24d7d6a54d84d83b5d67f384317b305f5ae704de4aa7573c9ab4a7e908c"
    },
    {
      "nodeId": "26:20",
      "path": "evidence/screenshots/ios-003-1/surface-system.png",
      "sha256": "4fde864e5b09910cd0d5fc3a436194f9b9ca4d751379cff3012bb5037c35b951"
    },
    {
      "nodeId": "27:19",